{
  "request_id": "9991adb6-c3bd-43aa-a3ba-05ff2173e53e",
  "document_id": "criminal_doc_1",
  "timestamp": "2026-06-12T09:53:04.601502Z",
  "status": "success",
  "error": null,
  "payload": {
    "document_type": "toa_an_hinh_su",
    "routing_confidence": 1.0,
    "field_coverage": 1.0,
    "missing_required_fields": [
      {
        "field": "ngay_thang_nam",
        "reason": "extraction_failed"
      }
    ],
    "extracted_fields": {
      "fixed": [
        {
          "field_name": "so_quyet_dinh",
          "value": "102/2026",
          "confidence": 1.0,
          "bbox": [
            52,
            126,
            620,
            146
          ],
          "method": "regex"
        },
        {
          "field_name": "ky_hieu",
          "value": "HS-ST",
          "confidence": 1.0,
          "bbox": [
            52,
            126,
            620,
            146
          ],
          "method": "regex"
        },
        {
          "field_name": "ten_co_quan_to_chuc",
          "value": "TÒA ÁN NHÂN DÂN TỈNH ĐỒNG NAI",
          "confidence": 0.9,
          "bbox": [
            52,
            54,
            620,
            74
          ],
          "method": "pattern_match"
        },
        {
          "field_name": "ten_loai_van_ban",
          "value": "BẢN ÁN",
          "confidence": 0.8,
          "bbox": [
            52,
            150,
            620,
            170
          ],
          "method": "pattern_match"
        }
      ],
      "dynamic": [
        {
          "field_name": "toi_danh",
          "value": "trộm cắp tài sản",
          "confidence": 0.8,
          "bbox": [
            52,
            174,
            620,
            194
          ],
          "method": "regex_label"
        },
        {
          "field_name": "ten_bi_cao",
          "value": "Trần Văn Hùng",
          "confidence": 0.8,
          "bbox": [
            52,
            198,
            620,
            218
          ],
          "method": "regex_label"
        },
        {
          "field_name": "dia_chi",
          "value": "phường Long Bình, thành phố Biên Hòa, tỉnh Đồng Nai",
          "confidence": 1.0,
          "bbox": [
            52,
            222,
            620,
            242
          ],
          "method": "regex_label"
        },
        {
          "field_name": "gia_tri_tai_san_chiem_doat",
          "value": "85.000.000",
          "confidence": 0.8,
          "bbox": [
            52,
            246,
            620,
            266
          ],
          "method": "regex_label"
        }
      ]
    },
    "correction_log": {
      "enabled": true,
      "changes": []
    }
  }
}