{
  "request_id": "72811048-1ec3-4b11-b2f1-35a6eeca7d39",
  "document_id": "local_doc_10",
  "timestamp": "2026-06-12T09:53:19.306651Z",
  "status": "success",
  "error": null,
  "payload": {
    "document_type": "toa_an_dan_su",
    "routing_confidence": 1.0,
    "field_coverage": 0.86,
    "missing_required_fields": [
      {
        "field": "ngay_thang_nam",
        "reason": "extraction_failed"
      },
      {
        "field": "ten_loai_van_ban",
        "reason": "not_in_source"
      }
    ],
    "extracted_fields": {
      "fixed": [
        {
          "field_name": "so_quyet_dinh",
          "value": "356/2019",
          "confidence": 0.9789950952240525,
          "bbox": [
            480,
            404,
            1452,
            440
          ],
          "method": "regex"
        },
        {
          "field_name": "ky_hieu",
          "value": "QĐ-PT",
          "confidence": 0.9789950952240525,
          "bbox": [
            480,
            404,
            1452,
            440
          ],
          "method": "regex"
        },
        {
          "field_name": "ten_co_quan_to_chuc",
          "value": "TÒA ÁN - T. CÀ MAU",
          "confidence": 0.9,
          "bbox": [
            52,
            174,
            620,
            194
          ],
          "method": "pattern_match"
        }
      ],
      "dynamic": [
        {
          "field_name": "nguyen_don",
          "value": "Ông Lê Duy Nam",
          "confidence": 1.0,
          "bbox": [
            464,
            1491,
            1164,
            1536
          ],
          "method": "regex_label"
        },
        {
          "field_name": "bi_don",
          "value": "Ông Phan Hoàng Khải",
          "confidence": 1.0,
          "bbox": [
            52,
            510,
            620,
            530
          ],
          "method": "regex_label"
        },
        {
          "field_name": "dia_chi",
          "value": "Ấp Bình Định, xã Tân Thành ， thành phố Cà Mau, tĩnh Ca Mai",
          "confidence": 1.0,
          "bbox": [
            52,
            582,
            620,
            602
          ],
          "method": "regex_label"
        }
      ]
    },
    "correction_log": {
      "enabled": true,
      "changes": [
        {
          "original": "Ấp Bình Định, xã Tân Thành， thành phố Cà Mau, tĩnh Ca Mai",
          "corrected": "Ấp Bình Định, xã Tân Thành ， thành phố Cà Mau, tĩnh Ca Mai",
          "field": "dia_chi",
          "method": "pipeline_correction",
          "sub_method": "symspell"
        }
      ]
    }
  }
}