{
  "request_id": "cba0530b-9aa6-41de-b012-93856d186bff",
  "document_id": "local_doc_5",
  "timestamp": "2026-06-12T09:52:54.617883Z",
  "status": "success",
  "error": null,
  "payload": {
    "document_type": "ngan_hang",
    "routing_confidence": 1.0,
    "field_coverage": 1.0,
    "missing_required_fields": [
      {
        "field": "ngay_thang_nam",
        "reason": "extraction_failed"
      }
    ],
    "extracted_fields": {
      "fixed": [
        {
          "field_name": "so_quyet_dinh",
          "value": "32/",
          "confidence": 1.0,
          "bbox": [
            64,
            76,
            540,
            93
          ],
          "method": "regex_simple"
        },
        {
          "field_name": "ky_hieu",
          "value": "QĐ-NTNN",
          "confidence": 0.7495649587754938,
          "bbox": [
            46,
            397,
            695,
            414
          ],
          "method": "regex"
        },
        {
          "field_name": "ten_co_quan_to_chuc",
          "value": "NGÂN HÀNG NHÀ NƯỚC VIỆT NAM",
          "confidence": 0.9,
          "bbox": [
            52,
            54,
            620,
            74
          ],
          "method": "pattern_match"
        },
        {
          "field_name": "ten_loai_van_ban",
          "value": "THÔNG TƯ",
          "confidence": 0.992,
          "bbox": [
            334,
            119,
            405,
            135
          ],
          "method": "pattern_match"
        }
      ],
      "dynamic": []
    },
    "correction_log": {
      "enabled": true,
      "changes": []
    }
  }
}