{
  "request_id": "df1d2309-16c1-413c-bff3-145cf0fe3716",
  "document_id": "local_doc_11",
  "timestamp": "2026-06-12T09:53:31.678761Z",
  "status": "success",
  "error": null,
  "payload": {
    "document_type": "toa_an_dan_su",
    "routing_confidence": 1.0,
    "field_coverage": 1.0,
    "missing_required_fields": [
      {
        "field": "ngay_thang_nam",
        "reason": "extraction_failed"
      }
    ],
    "extracted_fields": {
      "fixed": [
        {
          "field_name": "so_quyet_dinh",
          "value": "358/2019",
          "confidence": 1.0,
          "bbox": [
            436,
            352,
            856,
            392
          ],
          "method": "regex"
        },
        {
          "field_name": "ky_hieu",
          "value": "DS-PT",
          "confidence": 1.0,
          "bbox": [
            436,
            352,
            856,
            392
          ],
          "method": "regex"
        },
        {
          "field_name": "ten_co_quan_to_chuc",
          "value": "TÒA ÁN NHÂN DÂN",
          "confidence": 0.9,
          "bbox": [
            52,
            54,
            620,
            74
          ],
          "method": "pattern_match"
        },
        {
          "field_name": "ten_loai_van_ban",
          "value": "Bản án số: 358/2019/DS-PT",
          "confidence": 0.987,
          "bbox": [
            436,
            352,
            856,
            392
          ],
          "method": "pattern_match"
        }
      ],
      "dynamic": [
        {
          "field_name": "nguyen_don",
          "value": "Chị Lê Kim Chung",
          "confidence": 1.0,
          "bbox": [
            484,
            1412,
            1460,
            1460
          ],
          "method": "regex_label"
        },
        {
          "field_name": "dia_chi",
          "value": "69B, Lý Văn Lâm, khóm 5, phường 1, tỉnh Cà Mau, Cà Mau",
          "confidence": 1.0,
          "bbox": [
            484,
            1464,
            1656,
            1516
          ],
          "method": "regex_label"
        },
        {
          "field_name": "bi_don",
          "value": "Ông Phan Phòng Phú",
          "confidence": 1.0,
          "bbox": [
            475,
            1582,
            1429,
            1645
          ],
          "method": "regex_label"
        }
      ]
    },
    "correction_log": {
      "enabled": true,
      "changes": [
        {
          "original": "69B, Lý Văn Lâm, khóm 5 , phường 1, tỉnh Cà Mau Cà Mau",
          "corrected": "69B, Lý Văn Lâm, khóm 5, phường 1, tỉnh Cà Mau, Cà Mau",
          "field": "dia_chi",
          "method": "pipeline_correction",
          "sub_method": "vietnamese_model"
        }
      ]
    }
  }
}